{
  "$schema": "https://json-schema.org/draft/2020-12/schema",
  "$id": "https://schemas.npi.local/project_state_v1_7.schema.json",
  "title": "N2B1P local-research cache-promotion project state",
  "type": "object",
  "additionalProperties": false,
  "required": ["schema_version", "project", "baselines", "n2b0_5_baseline_sha", "n2b0_6_baseline_sha", "n2b0_7_baseline_sha", "authorization", "data_scope", "phase_status", "required_stop_after"],
  "properties": {
    "schema_version": {"const": "1.7"},
    "project": {"type": "object", "additionalProperties": false, "required": ["slug", "repository_relationship"], "properties": {"slug": {"const": "nightly-photo-intelligence-pipeline"}, "repository_relationship": {"const": "INDEPENDENT_FROM_ai-photography-director-app"}}},
    "baselines": {"type": "object", "additionalProperties": false, "required": ["N0", "N1", "G1", "N2A", "N2B0", "N2B0_5", "N2B0_6", "N2B0_7"], "properties": {"N0": {"$ref": "#/$defs/baseline"}, "N1": {"$ref": "#/$defs/baseline"}, "G1": {"$ref": "#/$defs/baseline"}, "N2A": {"$ref": "#/$defs/baseline"}, "N2B0": {"$ref": "#/$defs/baseline"}, "N2B0_5": {"$ref": "#/$defs/baseline"}, "N2B0_6": {"$ref": "#/$defs/baseline"}, "N2B0_7": {"$ref": "#/$defs/baseline"}}},
    "n2b0_5_baseline_sha": {"const": "5ad9f8d7d0d6fa267df02d90ef25957bc679e232"},
    "n2b0_6_baseline_sha": {"const": "eb2eaeb61f1c21923d131a115d63edbcdebd8cb2"},
    "n2b0_7_baseline_sha": {"const": "f2b1c38301d71da52b855f73de8a67908cb525ef"},
    "authorization": {
      "type": "object",
      "additionalProperties": false,
      "required": ["phase", "data_gate", "approval_record", "task_contract", "g1_completion_approval", "n2a_task_contract", "n2a_completion_approval", "n2b0_task_contract", "n2b0_completion_approval", "n2b0_5_task_contract", "n2b0_5_completion_approval", "n2b0_6_task_contract", "n2b0_6_completion_approval", "n2b0_7_task_contract", "n2b0_7_completion_approval", "local_research_continuation", "n2b1r_task_contract", "n2b1r_artifact_register", "n2b1r_acquisition_evidence", "n2b1p_owner_authorization", "n2b1p_task_contract", "n2b1p_promotion_evidence", "n2b1p_runtime_configuration", "active_execution", "capability_gates", "real_photo_access", "exif_real_data_read", "network_access", "large_model_downloads", "real_model_execution", "cloud_image_processing", "openclaw_activation", "git_remote_write", "system_configuration_changes", "ai_photography_director_app_changes"],
      "properties": {
        "phase": {"const": {"id": "N1", "status": "APPROVED_COMPLETE"}}, "data_gate": {"const": {"id": "G1_CALIBRATION_20", "status": "AUTHORIZED"}},
        "approval_record": {"const": "approvals/data_gate_approval_G1.yaml"}, "task_contract": {"const": "tasks/gate_g1_calibration_20.yaml"}, "g1_completion_approval": {"const": "approvals/phase_completion_G1.yaml"}, "n2a_task_contract": {"const": "tasks/phase_n2a_pose_and_segmentation_benchmark.yaml"}, "n2a_completion_approval": {"const": "approvals/phase_completion_N2A.yaml"}, "n2b0_task_contract": {"const": "tasks/phase_n2b0_model_artifact_qualification.yaml"}, "n2b0_completion_approval": {"const": "approvals/phase_completion_N2B0.yaml"}, "n2b0_5_task_contract": {"const": "tasks/phase_n2b0_5_artifact_rights_and_provenance.yaml"}, "n2b0_5_completion_approval": {"const": "approvals/phase_completion_N2B0_5.yaml"}, "n2b0_6_task_contract": {"const": "tasks/phase_n2b0_6_license_clear_alternative_candidate_research.yaml"}, "n2b0_6_completion_approval": {"const": "approvals/phase_completion_N2B0_6.yaml"}, "n2b0_7_task_contract": {"const": "tasks/phase_n2b0_7_gpu_native_qualification.yaml"}, "n2b0_7_completion_approval": {"const": "approvals/phase_completion_N2B0_7.yaml"}, "local_research_continuation": {"const": "approvals/owner_local_research_execution_N2B1R_to_N5R.yaml"}, "n2b1r_task_contract": {"const": "tasks/phase_n2b1r_local_research_model_acquisition.yaml"}, "n2b1r_artifact_register": {"const": "research/N2B1R_local_research_artifact_register.json"}, "n2b1r_acquisition_evidence": {"const": "research/N2B1R_acquisition_evidence.json"}, "n2b1p_owner_authorization": {"const": "approvals/owner_n2b1p_cache_promotion.yaml"}, "n2b1p_task_contract": {"const": "tasks/phase_n2b1p_local_research_cache_promotion.yaml"}, "n2b1p_promotion_evidence": {"const": "research/N2B1P_cache_promotion_evidence.json"}, "n2b1p_runtime_configuration": {"const": "approvals/n2b1p_runtime_configuration.json"},
        "active_execution": {"const": {"phase": "N2B1P", "capability": "N2B1P_LOCAL_RESEARCH_CACHE_PROMOTION", "source_photo_content_read": "NOT_AUTHORIZED", "source_photo_exif_read": "NOT_AUTHORIZED", "sqlite_ingest_write": "NOT_AUTHORIZED"}},
        "capability_gates": {"type": "object", "additionalProperties": false, "required": ["G1_COMPLETION", "N2A_POSE_SEGMENTATION_BENCHMARK_PREPARATION", "N2B0_MODEL_ARTIFACT_QUALIFICATION", "N2B0_5_ARTIFACT_RIGHTS_AND_PROVENANCE_CLOSURE", "N2B0_6_LICENSE_CLEAR_ALTERNATIVE_CANDIDATE_RESEARCH", "N2B0_7_GPU_NATIVE_QUALIFICATION", "N2B1R_LOCAL_RESEARCH_MODEL_ACQUISITION", "N2B1P_LOCAL_RESEARCH_CACHE_PROMOTION", "N2B_MODEL_DOWNLOAD_AND_INFERENCE", "N2B1_MODEL_DOWNLOAD", "N2B1_Q_QUARANTINE_DOWNLOAD", "N2B1_P_CACHE_PROMOTION", "N2B2_REAL_BENCHMARK"], "properties": {"G1_COMPLETION": {"$ref": "#/$defs/approved"}, "N2A_POSE_SEGMENTATION_BENCHMARK_PREPARATION": {"$ref": "#/$defs/approved"}, "N2B0_MODEL_ARTIFACT_QUALIFICATION": {"$ref": "#/$defs/approved"}, "N2B0_5_ARTIFACT_RIGHTS_AND_PROVENANCE_CLOSURE": {"$ref": "#/$defs/approved"}, "N2B0_6_LICENSE_CLEAR_ALTERNATIVE_CANDIDATE_RESEARCH": {"$ref": "#/$defs/approved"}, "N2B0_7_GPU_NATIVE_QUALIFICATION": {"$ref": "#/$defs/approved"}, "N2B1R_LOCAL_RESEARCH_MODEL_ACQUISITION": {"const": "ACQUISITION_COMPLETE"}, "N2B1P_LOCAL_RESEARCH_CACHE_PROMOTION": {"const": "AUTHORIZED"}, "N2B_MODEL_DOWNLOAD_AND_INFERENCE": {"$ref": "#/$defs/locked"}, "N2B1_MODEL_DOWNLOAD": {"$ref": "#/$defs/locked"}, "N2B1_Q_QUARANTINE_DOWNLOAD": {"$ref": "#/$defs/locked"}, "N2B1_P_CACHE_PROMOTION": {"$ref": "#/$defs/locked"}, "N2B2_REAL_BENCHMARK": {"$ref": "#/$defs/locked"}}},
        "real_photo_access": {"const": "AUTHORIZED"}, "exif_real_data_read": {"const": "AUTHORIZED_NON_SENSITIVE_ONLY"}, "network_access": {"const": "DENY_BY_DEFAULT"}, "large_model_downloads": {"const": "AUTHORIZED_RESEARCH_ONLY"}, "real_model_execution": {"const": "NOT_AUTHORIZED"}, "cloud_image_processing": {"const": "NOT_AUTHORIZED"}, "openclaw_activation": {"const": "NOT_AUTHORIZED"}, "git_remote_write": {"const": "NOT_AUTHORIZED"}, "system_configuration_changes": {"const": "NOT_AUTHORIZED"}, "ai_photography_director_app_changes": {"const": "NOT_AUTHORIZED"}
      }
    },
    "data_scope": {"type": "object", "additionalProperties": false, "required": ["max_assets", "allowed_assets", "G1_CALIBRATION_20", "N2A_BENCHMARK_SYNTHETIC_ONLY", "N2B0_MODEL_ARTIFACT_QUALIFICATION", "N2B0_5_ARTIFACT_RIGHTS_AND_PROVENANCE_CLOSURE", "N2B0_6_LICENSE_CLEAR_ALTERNATIVE_CANDIDATE_RESEARCH", "N2B0_7_GPU_NATIVE_QUALIFICATION", "N2B1R_LOCAL_RESEARCH_MODEL_ACQUISITION", "N2B1P_LOCAL_RESEARCH_CACHE_PROMOTION", "N2B_MODEL_DOWNLOAD_AND_INFERENCE", "N2B1_MODEL_DOWNLOAD", "N2B1_Q_QUARANTINE_DOWNLOAD", "N2B1_P_CACHE_PROMOTION", "N2B2_REAL_BENCHMARK", "G2_PILOT_100", "G3_FULL_LIBRARY"], "properties": {"max_assets": {"const": 20}, "allowed_assets": {"const": "owner-frozen manifest entries only"}, "G1_CALIBRATION_20": {"const": "AUTHORIZED"}, "N2A_BENCHMARK_SYNTHETIC_ONLY": {"const": "AUTHORIZED"}, "N2B0_MODEL_ARTIFACT_QUALIFICATION": {"$ref": "#/$defs/approved"}, "N2B0_5_ARTIFACT_RIGHTS_AND_PROVENANCE_CLOSURE": {"$ref": "#/$defs/approved"}, "N2B0_6_LICENSE_CLEAR_ALTERNATIVE_CANDIDATE_RESEARCH": {"$ref": "#/$defs/approved"}, "N2B0_7_GPU_NATIVE_QUALIFICATION": {"$ref": "#/$defs/approved"}, "N2B1R_LOCAL_RESEARCH_MODEL_ACQUISITION": {"const": "ACQUISITION_COMPLETE"}, "N2B1P_LOCAL_RESEARCH_CACHE_PROMOTION": {"const": "AUTHORIZED_CACHE_ONLY_NO_PHOTO_READ"}, "N2B_MODEL_DOWNLOAD_AND_INFERENCE": {"$ref": "#/$defs/locked"}, "N2B1_MODEL_DOWNLOAD": {"$ref": "#/$defs/locked"}, "N2B1_Q_QUARANTINE_DOWNLOAD": {"$ref": "#/$defs/locked"}, "N2B1_P_CACHE_PROMOTION": {"$ref": "#/$defs/locked"}, "N2B2_REAL_BENCHMARK": {"$ref": "#/$defs/locked"}, "G2_PILOT_100": {"$ref": "#/$defs/locked"}, "G3_FULL_LIBRARY": {"$ref": "#/$defs/locked"}}},
    "phase_status": {"type": "object", "additionalProperties": false, "required": ["N0", "N1", "G1", "N2", "N2A", "N2B0", "N2B0_5", "N2B0_6", "N2B0_7", "N2B", "N2B1", "N2B1R", "N2B1P", "N2B1_Q", "N2B1_P", "N2B2", "N3", "N4", "N5", "N6", "N7", "N8"], "properties": {"N0": {"$ref": "#/$defs/approved"}, "N1": {"$ref": "#/$defs/approved"}, "G1": {"$ref": "#/$defs/approved"}, "N2": {"$ref": "#/$defs/locked"}, "N2A": {"$ref": "#/$defs/approved"}, "N2B0": {"$ref": "#/$defs/approved"}, "N2B0_5": {"$ref": "#/$defs/approved"}, "N2B0_6": {"$ref": "#/$defs/approved"}, "N2B0_7": {"$ref": "#/$defs/approved"}, "N2B": {"$ref": "#/$defs/locked"}, "N2B1": {"$ref": "#/$defs/locked"}, "N2B1R": {"const": "ACQUISITION_COMPLETE"}, "N2B1P": {"const": "AUTHORIZED"}, "N2B1_Q": {"$ref": "#/$defs/locked"}, "N2B1_P": {"$ref": "#/$defs/locked"}, "N2B2": {"$ref": "#/$defs/locked"}, "N3": {"$ref": "#/$defs/locked"}, "N4": {"$ref": "#/$defs/locked"}, "N5": {"$ref": "#/$defs/locked"}, "N6": {"$ref": "#/$defs/locked"}, "N7": {"$ref": "#/$defs/locked"}, "N8": {"$ref": "#/$defs/locked"}}},
    "required_stop_after": {"type": "object", "additionalProperties": false, "required": ["condition", "next_action"], "properties": {"condition": {"const": "N2B1P_REMEDIATION_COMPLETE_AWAITING_EXTERNAL_REVIEW"}, "next_action": {"const": "EXTERNAL_REVIEW_N2B1P_REMEDIATION"}}}
  },
  "$defs": {
    "approved": {"const": "APPROVED_COMPLETE"},
    "locked": {"const": "LOCKED"},
    "baseline": {"type": "object", "additionalProperties": false, "required": ["commit", "tag", "status", "immutable"], "properties": {"commit": {"type": "string", "pattern": "^[0-9a-f]{40}$"}, "tag": {"type": "string", "minLength": 1}, "status": {"$ref": "#/$defs/approved"}, "immutable": {"const": true}}}
  }
}
