{
  "schema_version": "1.7",
  "project": {
    "slug": "nightly-photo-intelligence-pipeline",
    "repository_relationship": "INDEPENDENT_FROM_ai-photography-director-app"
  },
  "baselines": {
    "N0": {"commit": "72a81f5984838b74304d23263ac450ea4b5a3a9a", "tag": "n0-approved-2026-07-14", "status": "APPROVED_COMPLETE", "immutable": true},
    "N1": {"commit": "ca812cb71c4a09d273f64d9a6f2747ac3facf4cc", "tag": "n1-approved-2026-07-14", "status": "APPROVED_COMPLETE", "immutable": true},
    "G1": {"commit": "4a807dbbcd147a106b02b7e3899aa701c2028d83", "tag": "g1-approved-2026-07-19", "status": "APPROVED_COMPLETE", "immutable": true},
    "N2A": {"commit": "f79d2df504622ff82aa5e53d1486310bbea9985a", "tag": "n2a-approved-2026-07-22", "status": "APPROVED_COMPLETE", "immutable": true},
    "N2B0": {"commit": "f331621c84905aef921c612908d01d3a8a2f577a", "tag": "n2b0-approved-2026-07-24", "status": "APPROVED_COMPLETE", "immutable": true},
    "N2B0_5": {"commit": "5ad9f8d7d0d6fa267df02d90ef25957bc679e232", "tag": "n2b0-5-approved-2026-07-26", "status": "APPROVED_COMPLETE", "immutable": true},
    "N2B0_6": {"commit": "eb2eaeb61f1c21923d131a115d63edbcdebd8cb2", "tag": "n2b0-6-approved-2026-07-29", "status": "APPROVED_COMPLETE", "immutable": true},
    "N2B0_7": {"commit": "f2b1c38301d71da52b855f73de8a67908cb525ef", "tag": "n2b0-7-approved-2026-07-29", "status": "APPROVED_COMPLETE", "immutable": true}
  },
  "n2b0_5_baseline_sha": "5ad9f8d7d0d6fa267df02d90ef25957bc679e232",
  "n2b0_6_baseline_sha": "eb2eaeb61f1c21923d131a115d63edbcdebd8cb2",
  "n2b0_7_baseline_sha": "f2b1c38301d71da52b855f73de8a67908cb525ef",
  "authorization": {
    "phase": {"id": "N1", "status": "APPROVED_COMPLETE"},
    "data_gate": {"id": "G1_CALIBRATION_20", "status": "AUTHORIZED"},
    "approval_record": "approvals/data_gate_approval_G1.yaml",
    "task_contract": "tasks/gate_g1_calibration_20.yaml",
    "g1_completion_approval": "approvals/phase_completion_G1.yaml",
    "n2a_task_contract": "tasks/phase_n2a_pose_and_segmentation_benchmark.yaml",
    "n2a_completion_approval": "approvals/phase_completion_N2A.yaml",
    "n2b0_task_contract": "tasks/phase_n2b0_model_artifact_qualification.yaml",
    "n2b0_completion_approval": "approvals/phase_completion_N2B0.yaml",
    "n2b0_5_task_contract": "tasks/phase_n2b0_5_artifact_rights_and_provenance.yaml",
    "n2b0_5_completion_approval": "approvals/phase_completion_N2B0_5.yaml",
    "n2b0_6_task_contract": "tasks/phase_n2b0_6_license_clear_alternative_candidate_research.yaml",
    "n2b0_6_completion_approval": "approvals/phase_completion_N2B0_6.yaml",
    "n2b0_7_task_contract": "tasks/phase_n2b0_7_gpu_native_qualification.yaml",
    "n2b0_7_completion_approval": "approvals/phase_completion_N2B0_7.yaml",
    "local_research_continuation": "approvals/owner_local_research_execution_N2B1R_to_N5R.yaml",
    "n2b1r_task_contract": "tasks/phase_n2b1r_local_research_model_acquisition.yaml",
    "n2b1r_artifact_register": "research/N2B1R_local_research_artifact_register.json",
    "n2b1r_acquisition_evidence": "research/N2B1R_acquisition_evidence.json",
    "n2b1p_owner_authorization": "approvals/owner_n2b1p_cache_promotion.yaml",
    "n2b1p_task_contract": "tasks/phase_n2b1p_local_research_cache_promotion.yaml",
    "n2b1p_promotion_evidence": "research/N2B1P_cache_promotion_evidence.json",
    "n2b1p_runtime_configuration": "approvals/n2b1p_runtime_configuration.json",
    "active_execution": {
      "phase": "N2B1P",
      "capability": "N2B1P_LOCAL_RESEARCH_CACHE_PROMOTION",
      "source_photo_content_read": "NOT_AUTHORIZED",
      "source_photo_exif_read": "NOT_AUTHORIZED",
      "sqlite_ingest_write": "NOT_AUTHORIZED"
    },
    "capability_gates": {
      "G1_COMPLETION": "APPROVED_COMPLETE",
      "N2A_POSE_SEGMENTATION_BENCHMARK_PREPARATION": "APPROVED_COMPLETE",
      "N2B0_MODEL_ARTIFACT_QUALIFICATION": "APPROVED_COMPLETE",
      "N2B0_5_ARTIFACT_RIGHTS_AND_PROVENANCE_CLOSURE": "APPROVED_COMPLETE",
      "N2B0_6_LICENSE_CLEAR_ALTERNATIVE_CANDIDATE_RESEARCH": "APPROVED_COMPLETE",
      "N2B0_7_GPU_NATIVE_QUALIFICATION": "APPROVED_COMPLETE",
      "N2B1R_LOCAL_RESEARCH_MODEL_ACQUISITION": "ACQUISITION_COMPLETE",
      "N2B1P_LOCAL_RESEARCH_CACHE_PROMOTION": "AUTHORIZED",
      "N2B_MODEL_DOWNLOAD_AND_INFERENCE": "LOCKED",
      "N2B1_MODEL_DOWNLOAD": "LOCKED",
      "N2B1_Q_QUARANTINE_DOWNLOAD": "LOCKED",
      "N2B1_P_CACHE_PROMOTION": "LOCKED",
      "N2B2_REAL_BENCHMARK": "LOCKED"
    },
    "real_photo_access": "AUTHORIZED",
    "exif_real_data_read": "AUTHORIZED_NON_SENSITIVE_ONLY",
    "network_access": "DENY_BY_DEFAULT",
    "large_model_downloads": "AUTHORIZED_RESEARCH_ONLY",
    "real_model_execution": "NOT_AUTHORIZED",
    "cloud_image_processing": "NOT_AUTHORIZED",
    "openclaw_activation": "NOT_AUTHORIZED",
    "git_remote_write": "NOT_AUTHORIZED",
    "system_configuration_changes": "NOT_AUTHORIZED",
    "ai_photography_director_app_changes": "NOT_AUTHORIZED"
  },
  "data_scope": {
    "max_assets": 20,
    "allowed_assets": "owner-frozen manifest entries only",
    "G1_CALIBRATION_20": "AUTHORIZED",
    "N2A_BENCHMARK_SYNTHETIC_ONLY": "AUTHORIZED",
    "N2B0_MODEL_ARTIFACT_QUALIFICATION": "APPROVED_COMPLETE",
    "N2B0_5_ARTIFACT_RIGHTS_AND_PROVENANCE_CLOSURE": "APPROVED_COMPLETE",
    "N2B0_6_LICENSE_CLEAR_ALTERNATIVE_CANDIDATE_RESEARCH": "APPROVED_COMPLETE",
    "N2B0_7_GPU_NATIVE_QUALIFICATION": "APPROVED_COMPLETE",
    "N2B1R_LOCAL_RESEARCH_MODEL_ACQUISITION": "ACQUISITION_COMPLETE",
    "N2B1P_LOCAL_RESEARCH_CACHE_PROMOTION": "AUTHORIZED_CACHE_ONLY_NO_PHOTO_READ",
    "N2B_MODEL_DOWNLOAD_AND_INFERENCE": "LOCKED",
    "N2B1_MODEL_DOWNLOAD": "LOCKED",
    "N2B1_Q_QUARANTINE_DOWNLOAD": "LOCKED",
    "N2B1_P_CACHE_PROMOTION": "LOCKED",
    "N2B2_REAL_BENCHMARK": "LOCKED",
    "G2_PILOT_100": "LOCKED",
    "G3_FULL_LIBRARY": "LOCKED"
  },
  "phase_status": {
    "N0": "APPROVED_COMPLETE", "N1": "APPROVED_COMPLETE", "G1": "APPROVED_COMPLETE", "N2": "LOCKED", "N2A": "APPROVED_COMPLETE", "N2B0": "APPROVED_COMPLETE", "N2B0_5": "APPROVED_COMPLETE", "N2B0_6": "APPROVED_COMPLETE", "N2B0_7": "APPROVED_COMPLETE", "N2B": "LOCKED", "N2B1": "LOCKED", "N2B1R": "ACQUISITION_COMPLETE", "N2B1P": "AUTHORIZED", "N2B1_Q": "LOCKED", "N2B1_P": "LOCKED", "N2B2": "LOCKED", "N3": "LOCKED", "N4": "LOCKED", "N5": "LOCKED", "N6": "LOCKED", "N7": "LOCKED", "N8": "LOCKED"
  },
  "required_stop_after": {
    "condition": "N2B1P_REMEDIATION_COMPLETE_AWAITING_EXTERNAL_REVIEW",
    "next_action": "EXTERNAL_REVIEW_N2B1P_REMEDIATION"
  }
}
